{
  "name": "hybrid-mobile-architecture",
  "version": "2.0.0-alpha.4",
  "description": "Versioned, non-destructive application generator and instruction pack for governed agentic applications.",
  "author": {
    "name": "Travis James",
    "email": "travis@prometheusags.ai",
    "url": "https://travisjames.ai"
  },
  "homepage": "https://github.com/Know-Me-Tools/hybrid-mobile-architecture-skill",
  "repository": "https://github.com/Know-Me-Tools/hybrid-mobile-architecture-skill",
  "license": "MIT",
  "keywords": [
    "flutter",
    "tauri",
    "rust",
    "react",
    "axum",
    "uar",
    "a2ui",
    "ag-ui",
    "agentic-applications"
  ],
  "skills": [
    "./skills/hybrid-mobile-architecture",
    "./skills/a11y-gate",
    "./skills/build-branded-docusaurus",
    "./skills/client-rag",
    "./skills/content-block-ui",
    "./skills/dependency-pin-discipline",
    "./skills/deploy-hybrid-agentic-stack",
    "./skills/flutter-golden-ui",
    "./skills/hybrid-design-tokens",
    "./skills/hybrid-runtime-verification",
    "./skills/karpathy-progress-memory",
    "./skills/local-inference-lanes",
    "./skills/mobile-navigation",
    "./skills/orchestrate-prometheus-application",
    "./skills/peer-profile-sync",
    "./skills/pem-local-first",
    "./skills/reference-ui-fidelity",
    "./skills/sync-doctrine",
    "./skills/tauri-custom-titlebar",
    "./skills/tauri-ui-review",
    "./skills/entity-graph-web-shell",
    "./skills/mini-app-module",
    "./skills/axum-agent-gateway",
    "./skills/legacy-app-embed",
    "./skills/a2ui-surface-contract",
    "./skills/agui-event-contract",
    "./skills/agent-runtime-security",
    "./skills/anonymized-replica",
    "./skills/persona-scoped-agent",
    "./skills/domain-glossary-service",
    "./skills/connected-skill-packages",
    "./skills/tauri-tray-app",
    "./skills/launchagent-supervisor",
    "./skills/realtime-skill-refiner",
    "./skills/claude-hooks-reliability",
    "./skills/auto-skill-package-integration"
  ],
  "mcpServers": "./.mcp.json"
}
